{
  "task_id": "TASK-20260613-001",
  "title": "Добавить экспорт отчётов в CSV",
  "description": "Пользователь должен иметь возможность экспортировать таблицу отчётов в CSV через кнопку в UI. Backend: эндпоинт стриминга. Frontend: кнопка и обработка blob.",
  "created_at": "2026-06-13T10:00:00Z",
  "updated_at": "2026-06-13T10:30:00Z",
  "current_stage": "SHAPING",
  "active_agent": "shaper",
  "tech_stacks": [],
  "history": [
    {
      "step": 0,
      "timestamp": "2026-06-13T10:00:00Z",
      "from_agent": "user",
      "to_agent": "manager",
      "stage": "INIT",
      "summary": "Получена задача от пользователя. Инициализирован WORKSPACE."
    },
    {
      "step": 1,
      "timestamp": "2026-06-13T10:05:00Z",
      "from_agent": "manager",
      "to_agent": "shaper",
      "stage": "SHAPING",
      "summary": "Делегирован shaping: требования + архитектура + декомпозиция в один проход.",
      "brief_path": "handoffs/01_shaper_brief.md"
    }
  ],
  "artifacts": {},
  "blockers": []
}
